{"version":1,"signer":"uoES-kuj1vk0sq0qoGlmAg","run_id":"0192f0c1-7d4e-7a2b-8c3d-4e5f6a7b8c9d","workspace":"ws_f1xt0re000000000","node_id":"np_f1xt0re000000000","gateway":"ng_f1xt0re000000000","gateway_url":"https://gateway.example:8443","gateway_public_key":[{"alg":"ed25519","public_key":"iC0Oo7KGTnpYfz5pjOpEWZmDEuZV4F-l6LURnYuqyM0"}],"instance_id":"i_gYKDhIWGh4iJiouMjY6PkA","issued":"2026-10-11T12:00:00Z","attach_by":"2026-10-11T12:10:00Z"}